{
  "fixtureSchema": "urn:uuid:96042323-b06d-4c04-a3ab-0b1d646f6869",
  "protocolRelease": "ghostbridge/e1.r0-draft.1",
  "classification": "equality-order",
  "cases": [
    {
      "id": "FND-PROTOCOL-RELEASE-EQ-FINAL-SAME",
      "kind": "equality",
      "targetSchema": "urn:uuid:f27a43b2-052e-4f02-aeb5-2ea4f21f4e17",
      "operation": "exact-equality",
      "values": ["ghostbridge/e1.r0", "ghostbridge/e1.r0"],
      "equalExpected": true
    },
    {
      "id": "FND-PROTOCOL-RELEASE-EQ-EXPERIMENTAL-SAME",
      "kind": "equality",
      "targetSchema": "urn:uuid:f27a43b2-052e-4f02-aeb5-2ea4f21f4e17",
      "operation": "exact-equality",
      "values": ["ghostbridge/e1.r0-experimental.0", "ghostbridge/e1.r0-experimental.0"],
      "equalExpected": true
    },
    {
      "id": "FND-PROTOCOL-RELEASE-EQ-RC-MAXIMUM-SAME",
      "kind": "equality",
      "targetSchema": "urn:uuid:f27a43b2-052e-4f02-aeb5-2ea4f21f4e17",
      "operation": "exact-equality",
      "values": [
        "ghostbridge/e2147483647.r2147483647-rc.2147483647",
        "ghostbridge/e2147483647.r2147483647-rc.2147483647"
      ],
      "equalExpected": true
    },
    {
      "id": "FND-PROTOCOL-RELEASE-EQ-EPOCH-DIFFERENT",
      "kind": "equality",
      "targetSchema": "urn:uuid:f27a43b2-052e-4f02-aeb5-2ea4f21f4e17",
      "operation": "exact-equality",
      "values": ["ghostbridge/e0.r0", "ghostbridge/e1.r0"],
      "equalExpected": false
    },
    {
      "id": "FND-PROTOCOL-RELEASE-EQ-REVISION-DIFFERENT",
      "kind": "equality",
      "targetSchema": "urn:uuid:f27a43b2-052e-4f02-aeb5-2ea4f21f4e17",
      "operation": "exact-equality",
      "values": ["ghostbridge/e1.r0", "ghostbridge/e1.r1"],
      "equalExpected": false
    },
    {
      "id": "FND-PROTOCOL-RELEASE-EQ-STAGE-DIFFERENT",
      "kind": "equality",
      "targetSchema": "urn:uuid:f27a43b2-052e-4f02-aeb5-2ea4f21f4e17",
      "operation": "exact-equality",
      "values": ["ghostbridge/e1.r0-alpha.1", "ghostbridge/e1.r0-beta.1"],
      "equalExpected": false
    },
    {
      "id": "FND-PROTOCOL-RELEASE-EQ-ITERATION-DIFFERENT",
      "kind": "equality",
      "targetSchema": "urn:uuid:f27a43b2-052e-4f02-aeb5-2ea4f21f4e17",
      "operation": "exact-equality",
      "values": ["ghostbridge/e1.r0-draft.1", "ghostbridge/e1.r0-draft.2"],
      "equalExpected": false
    },
    {
      "id": "FND-PROTOCOL-RELEASE-ORD-EQUAL-FINAL",
      "kind": "ordering",
      "targetSchema": "urn:uuid:f27a43b2-052e-4f02-aeb5-2ea4f21f4e17",
      "operation": "compare",
      "left": "ghostbridge/e1.r0",
      "right": "ghostbridge/e1.r0",
      "orderExpected": "EQUAL"
    },
    {
      "id": "FND-PROTOCOL-RELEASE-ORD-EQUAL-NONFINAL",
      "kind": "ordering",
      "targetSchema": "urn:uuid:f27a43b2-052e-4f02-aeb5-2ea4f21f4e17",
      "operation": "compare",
      "left": "ghostbridge/e1.r0-rc.1",
      "right": "ghostbridge/e1.r0-rc.1",
      "orderExpected": "EQUAL"
    },
    {
      "id": "FND-PROTOCOL-RELEASE-ORD-EPOCH-LESS",
      "kind": "ordering",
      "targetSchema": "urn:uuid:f27a43b2-052e-4f02-aeb5-2ea4f21f4e17",
      "operation": "compare",
      "left": "ghostbridge/e0.r0",
      "right": "ghostbridge/e1.r0",
      "orderExpected": "LESS"
    },
    {
      "id": "FND-PROTOCOL-RELEASE-ORD-EPOCH-GREATER-OVERRIDES",
      "kind": "ordering",
      "targetSchema": "urn:uuid:f27a43b2-052e-4f02-aeb5-2ea4f21f4e17",
      "operation": "compare",
      "left": "ghostbridge/e1.r0-experimental.0",
      "right": "ghostbridge/e0.r2147483647",
      "orderExpected": "GREATER"
    },
    {
      "id": "FND-PROTOCOL-RELEASE-ORD-EPOCH-LOWER-OVERRIDES",
      "kind": "ordering",
      "targetSchema": "urn:uuid:f27a43b2-052e-4f02-aeb5-2ea4f21f4e17",
      "operation": "compare",
      "left": "ghostbridge/e0.r2147483647",
      "right": "ghostbridge/e1.r0-experimental.0",
      "orderExpected": "LESS"
    },
    {
      "id": "FND-PROTOCOL-RELEASE-ORD-REVISION-LESS",
      "kind": "ordering",
      "targetSchema": "urn:uuid:f27a43b2-052e-4f02-aeb5-2ea4f21f4e17",
      "operation": "compare",
      "left": "ghostbridge/e1.r0",
      "right": "ghostbridge/e1.r1",
      "orderExpected": "LESS"
    },
    {
      "id": "FND-PROTOCOL-RELEASE-ORD-REVISION-GREATER-OVERRIDES",
      "kind": "ordering",
      "targetSchema": "urn:uuid:f27a43b2-052e-4f02-aeb5-2ea4f21f4e17",
      "operation": "compare",
      "left": "ghostbridge/e1.r1-experimental.0",
      "right": "ghostbridge/e1.r0",
      "orderExpected": "GREATER"
    },
    {
      "id": "FND-PROTOCOL-RELEASE-ORD-REVISION-LOWER-OVERRIDES",
      "kind": "ordering",
      "targetSchema": "urn:uuid:f27a43b2-052e-4f02-aeb5-2ea4f21f4e17",
      "operation": "compare",
      "left": "ghostbridge/e1.r0",
      "right": "ghostbridge/e1.r1-experimental.0",
      "orderExpected": "LESS"
    },
    {
      "id": "FND-PROTOCOL-RELEASE-ORD-EXPERIMENTAL-DRAFT",
      "kind": "ordering",
      "targetSchema": "urn:uuid:f27a43b2-052e-4f02-aeb5-2ea4f21f4e17",
      "operation": "compare",
      "left": "ghostbridge/e1.r0-experimental.0",
      "right": "ghostbridge/e1.r0-draft.0",
      "orderExpected": "LESS"
    },
    {
      "id": "FND-PROTOCOL-RELEASE-ORD-DRAFT-ALPHA",
      "kind": "ordering",
      "targetSchema": "urn:uuid:f27a43b2-052e-4f02-aeb5-2ea4f21f4e17",
      "operation": "compare",
      "left": "ghostbridge/e1.r0-draft.0",
      "right": "ghostbridge/e1.r0-alpha.0",
      "orderExpected": "LESS"
    },
    {
      "id": "FND-PROTOCOL-RELEASE-ORD-ALPHA-BETA",
      "kind": "ordering",
      "targetSchema": "urn:uuid:f27a43b2-052e-4f02-aeb5-2ea4f21f4e17",
      "operation": "compare",
      "left": "ghostbridge/e1.r0-alpha.0",
      "right": "ghostbridge/e1.r0-beta.0",
      "orderExpected": "LESS"
    },
    {
      "id": "FND-PROTOCOL-RELEASE-ORD-BETA-RC",
      "kind": "ordering",
      "targetSchema": "urn:uuid:f27a43b2-052e-4f02-aeb5-2ea4f21f4e17",
      "operation": "compare",
      "left": "ghostbridge/e1.r0-beta.0",
      "right": "ghostbridge/e1.r0-rc.0",
      "orderExpected": "LESS"
    },
    {
      "id": "FND-PROTOCOL-RELEASE-ORD-RC-FINAL",
      "kind": "ordering",
      "targetSchema": "urn:uuid:f27a43b2-052e-4f02-aeb5-2ea4f21f4e17",
      "operation": "compare",
      "left": "ghostbridge/e1.r0-rc.0",
      "right": "ghostbridge/e1.r0",
      "orderExpected": "LESS"
    },
    {
      "id": "FND-PROTOCOL-RELEASE-ORD-FINAL-AFTER-RC-MAXIMUM",
      "kind": "ordering",
      "targetSchema": "urn:uuid:f27a43b2-052e-4f02-aeb5-2ea4f21f4e17",
      "operation": "compare",
      "left": "ghostbridge/e1.r0",
      "right": "ghostbridge/e1.r0-rc.2147483647",
      "orderExpected": "GREATER"
    },
    {
      "id": "FND-PROTOCOL-RELEASE-ORD-STAGE-OVERRIDES-HIGH-ITERATION",
      "kind": "ordering",
      "targetSchema": "urn:uuid:f27a43b2-052e-4f02-aeb5-2ea4f21f4e17",
      "operation": "compare",
      "left": "ghostbridge/e1.r0-draft.0",
      "right": "ghostbridge/e1.r0-experimental.2147483647",
      "orderExpected": "GREATER"
    },
    {
      "id": "FND-PROTOCOL-RELEASE-ORD-STAGE-OVERRIDE-REVERSED",
      "kind": "ordering",
      "targetSchema": "urn:uuid:f27a43b2-052e-4f02-aeb5-2ea4f21f4e17",
      "operation": "compare",
      "left": "ghostbridge/e1.r0-experimental.2147483647",
      "right": "ghostbridge/e1.r0-draft.0",
      "orderExpected": "LESS"
    },
    {
      "id": "FND-PROTOCOL-RELEASE-ORD-ITERATION-LESS",
      "kind": "ordering",
      "targetSchema": "urn:uuid:f27a43b2-052e-4f02-aeb5-2ea4f21f4e17",
      "operation": "compare",
      "left": "ghostbridge/e1.r0-beta.0",
      "right": "ghostbridge/e1.r0-beta.1",
      "orderExpected": "LESS"
    },
    {
      "id": "FND-PROTOCOL-RELEASE-ORD-ITERATION-GREATER",
      "kind": "ordering",
      "targetSchema": "urn:uuid:f27a43b2-052e-4f02-aeb5-2ea4f21f4e17",
      "operation": "compare",
      "left": "ghostbridge/e1.r0-beta.2147483647",
      "right": "ghostbridge/e1.r0-beta.1",
      "orderExpected": "GREATER"
    },
    {
      "id": "FND-PROTOCOL-RELEASE-ORD-EPOCH-MAXIMUM-EDGE",
      "kind": "ordering",
      "targetSchema": "urn:uuid:f27a43b2-052e-4f02-aeb5-2ea4f21f4e17",
      "operation": "compare",
      "left": "ghostbridge/e2147483646.r2147483647",
      "right": "ghostbridge/e2147483647.r0-experimental.0",
      "orderExpected": "LESS"
    },
    {
      "id": "FND-PROTOCOL-RELEASE-ORD-REVISION-MAXIMUM-EDGE",
      "kind": "ordering",
      "targetSchema": "urn:uuid:f27a43b2-052e-4f02-aeb5-2ea4f21f4e17",
      "operation": "compare",
      "left": "ghostbridge/e2147483647.r2147483646",
      "right": "ghostbridge/e2147483647.r2147483647-experimental.0",
      "orderExpected": "LESS"
    },
    {
      "id": "FND-PROTOCOL-RELEASE-ORD-EQUAL-MAXIMUM-IDENTITY",
      "kind": "ordering",
      "targetSchema": "urn:uuid:f27a43b2-052e-4f02-aeb5-2ea4f21f4e17",
      "operation": "compare",
      "left": "ghostbridge/e2147483647.r2147483647-experimental.2147483647",
      "right": "ghostbridge/e2147483647.r2147483647-experimental.2147483647",
      "orderExpected": "EQUAL"
    }
  ]
}
